{
  "$schema": "./schemas/evidence.schema.json",
  "sources": [
    {
      "id": "alex-interview",
      "label": "Alex, interview answers (20 Oct 2026)",
      "kind": "author-statement"
    },
    {
      "id": "cv",
      "label": "CV (September 2026)",
      "kind": "cv"
    },
    {
      "id": "zim-github",
      "label": "GitHub profile: ZIM Connections section",
      "kind": "profile",
      "url": "https://github.com/Alex90Jennings"
    },
    {
      "id": "zim-linkedin",
      "label": "Author's project description for LinkedIn",
      "kind": "author-statement"
    },
    {
      "id": "sbb-notes",
      "label": "Author's notes on ZIM@SBB",
      "kind": "author-statement"
    },
    {
      "id": "operafy-infra-readme",
      "label": "operafy-infra README",
      "kind": "repository",
      "url": "https://github.com/Alex90Jennings/operafy-infra"
    },
    {
      "id": "operafy-linkedin",
      "label": "Author's project descriptions for LinkedIn",
      "kind": "author-statement"
    },
    {
      "id": "operafy-github",
      "label": "GitHub profile: Operafy sections",
      "kind": "profile",
      "url": "https://github.com/Alex90Jennings"
    },
    {
      "id": "clash-readme",
      "label": "Clash of Langs README",
      "kind": "repository",
      "url": "https://github.com/Alex90Jennings/clash-of-langs"
    },
    {
      "id": "clash-architecture",
      "label": "docs/ARCHITECTURE.md",
      "kind": "documentation",
      "url": "https://github.com/Alex90Jennings/clash-of-langs/blob/main/docs/ARCHITECTURE.md"
    },
    {
      "id": "clash-benchmarking",
      "label": "docs/BENCHMARKING.md",
      "kind": "documentation",
      "url": "https://github.com/Alex90Jennings/clash-of-langs/blob/main/docs/BENCHMARKING.md"
    },
    {
      "id": "sol-readme",
      "label": "SOL README",
      "kind": "repository"
    },
    {
      "id": "sol-audit",
      "label": "SOL accessibility audit and verification (17 Oct 2026)",
      "kind": "documentation"
    },
    {
      "id": "tg-readme",
      "label": "Total Guess README",
      "kind": "repository",
      "url": "https://github.com/Alex90Jennings/total-guess"
    },
    {
      "id": "tg-retrieval",
      "label": "docs/retrieval.md",
      "kind": "documentation",
      "url": "https://github.com/Alex90Jennings/total-guess/blob/main/packages/ingestion/docs/retrieval.md"
    },
    {
      "id": "alex-confirmation",
      "label": "Alex, final confirmations (20 Oct 2026)",
      "kind": "author-statement"
    }
  ],
  "stories": [
    {
      "id": "zim-sbb-feature-scope",
      "title": "Agreeing the scope of the white-label apps",
      "projects": [
        "zim-sbb",
        "zim-connections"
      ],
      "organisation": "ZIM Connections Ltd.",
      "situation": {
        "text": "As ZIM built white-label apps for partners, including ZIM@SBB for Swiss Federal Railways, the product team wanted to bring more features from the main ZIM app into the partner apps.",
        "provenance": "firsthand",
        "sources": [
          "alex-interview",
          "sbb-notes"
        ]
      },
      "task": {
        "text": "Engineering had to balance those product goals against the long-term cost of maintaining increasingly complex partner-specific functionality.",
        "provenance": "firsthand",
        "sources": [
          "alex-interview"
        ]
      },
      "action": {
        "text": "Alex took part in the discussions, explaining the technical implications of including too many features. With the product stakeholders, the team prioritised functionality, agreed a minimum viable product and defined a manageable scope.",
        "detail": "Alex worked with the product team to translate business requirements into a clearly defined technical scope.",
        "provenance": "firsthand",
        "sources": [
          "alex-interview"
        ]
      },
      "result": {
        "text": "They reached a compromise between the product team's ambitions and engineering's concerns about maintainability.",
        "provenance": "firsthand",
        "sources": [
          "alex-interview"
        ]
      },
      "reflection": {
        "text": "Alex's view is that agreeing a minimum viable product, scoping carefully and keeping communication open is the most efficient way for technical and non-technical stakeholders to work together.",
        "provenance": "firsthand",
        "sources": [
          "alex-interview"
        ]
      },
      "competencies": [
        "conflict-resolution",
        "collaboration",
        "communication",
        "working-with-ambiguity",
        "prioritisation",
        "cross-functional-ownership"
      ],
      "questions": [
        "Tell me about a time you disagreed with product stakeholders.",
        "How do you handle conflicting product and engineering priorities?",
        "How do you handle unclear requirements?",
        "How do you work with non-technical stakeholders?"
      ],
      "attribution": "collaborative",
      "attributionNote": "A discussion between product and engineering. Alex explained the technical implications; product and engineering agreed the scope together.",
      "status": "approved",
      "visibility": "public"
    },
    {
      "id": "zim-aws-cost-review",
      "title": "Finding savings in ZIM’s AWS bill",
      "projects": [
        "zim-connections"
      ],
      "organisation": "ZIM Connections Ltd.",
      "situation": {
        "text": "While studying for the AWS Certified Cloud Practitioner certification, Alex became interested in how ZIM used its cloud infrastructure.",
        "provenance": "firsthand",
        "sources": [
          "alex-interview",
          "cv"
        ]
      },
      "task": {
        "text": "Alex set out to find where ZIM could reduce its AWS costs without compromising performance.",
        "provenance": "firsthand",
        "sources": [
          "alex-interview"
        ]
      },
      "action": {
        "text": "Alex independently reviewed the AWS services ZIM used, documented what each was for, identified where there was room to scale back, and presented the findings to the CEO and CTO.",
        "provenance": "firsthand",
        "sources": [
          "alex-interview"
        ]
      },
      "result": {
        "text": "ZIM reduced its AWS bill by approximately 30%, with no reported negative impact on performance.",
        "provenance": "firsthand",
        "sources": [
          "alex-interview"
        ]
      },
      "competencies": [
        "initiative",
        "communication",
        "problem-solving",
        "continuous-improvement"
      ],
      "questions": [
        "Tell me about a time you improved something without being asked.",
        "Have you identified opportunities to save money?",
        "Tell me about a time you explained something technical to a non-technical stakeholder."
      ],
      "attribution": "individual",
      "attributionNote": "Alex researched the services and presented the recommendations. This does not claim Alex implemented every infrastructure change.",
      "status": "approved",
      "visibility": "public"
    },
    {
      "id": "zim-sql-performance",
      "title": "Speeding up the eSIM retrieval endpoint",
      "projects": [
        "zim-connections"
      ],
      "organisation": "ZIM Connections Ltd.",
      "situation": {
        "text": "At ZIM, the API endpoint that fetched customers' eSIMs was responding slowly.",
        "provenance": "firsthand",
        "sources": [
          "alex-interview"
        ]
      },
      "task": {
        "text": "Alex set out to find the cause and make the endpoint more responsive.",
        "provenance": "firsthand",
        "sources": [
          "alex-interview"
        ]
      },
      "action": {
        "text": "Alex traced the SQL queries the endpoint ran and read through the backend code. That showed a number of repeated queries, and one query that needed better indexing to run faster.",
        "provenance": "firsthand",
        "sources": [
          "alex-interview"
        ]
      },
      "result": {
        "text": "Response times fell from roughly 2–9 seconds to 0.5–1.5 seconds.",
        "provenance": "firsthand",
        "sources": [
          "alex-interview"
        ]
      },
      "competencies": [
        "problem-solving",
        "attention-to-detail",
        "continuous-improvement"
      ],
      "questions": [
        "Describe a difficult technical problem you solved.",
        "How do you approach debugging?",
        "Tell me about a time you improved performance."
      ],
      "attribution": "individual",
      "attributionNote": "Alex's own investigation and optimisation.",
      "status": "approved",
      "visibility": "public"
    },
    {
      "id": "zim-black-friday",
      "title": "Fixing the Black Friday discount problem",
      "projects": [
        "zim-connections"
      ],
      "organisation": "ZIM Connections Ltd.",
      "situation": {
        "text": "During a Black Friday promotion at ZIM, customers who already had an eligible discount larger than the promotional offer couldn't use it.",
        "detail": "Working in a fast-moving startup environment meant adapting to changing product requirements and priorities. The team had missed this case.",
        "provenance": "firsthand",
        "sources": [
          "alex-interview"
        ]
      },
      "task": {
        "text": "The problem affected real customers in production, so it needed fixing quickly and safely.",
        "provenance": "firsthand",
        "sources": [
          "alex-interview"
        ]
      },
      "action": {
        "text": "Alex paused the current task, investigated, reproduced the behaviour in a development environment, and changed the promotion logic: customers could change the applied promotion, and the larger eligible discount was selected automatically.",